{
  "schema_version": "0.1.0",
  "contract_type": "ltt.sealed_evaluation_authorization",
  "status": "unassigned",
  "authorization_id": null,
  "authorized_at": null,
  "pilot_barrier_id": null,
  "fold_worker_capability_id": null,
  "fold_worker_capability_contract": null,
  "parent_design_manifest_sha256": "8c974390ceea3f1defaae19067359c909b4182dd26c321075c9e25ee1518e64b",
  "execution_lock_sha256": null,
  "pre_auditor_query_ledger_sha256": null,
  "fold_id": null,
  "fold_token": null,
  "heldout_dependency_cluster_id": null,
  "heldout_model_unit_ids": [],
  "development_dependency_cluster_ids": [],
  "development_model_unit_ids": [],
  "counts": {
    "target_count": 9,
    "heldout_target_count": 3,
    "development_target_count": 6,
    "sealed_weak_trial_count": 2880,
    "sealed_challenge_trial_count": 1152,
    "sealed_forward_pass_count": 4032,
    "heldout_weak_observation_count": 960,
    "trial_count_per_slot": 64,
    "heldout_challenge_trial_count": 384,
    "development_challenge_trial_count": 768
  },
  "blind_bundle_sha256": null,
  "prospective_contract": null,
  "sealed_weak_trials_sha256": null,
  "sealed_challenge_trials_sha256": null,
  "challenge_bundle_sha256": null,
  "evaluation_key_sha256": null,
  "weak_observation_records_sha256": null,
  "heldout_slot_inventory_sha256": null,
  "heldout_scoring_key_sha256": null,
  "development_slot_inventory_sha256": null,
  "development_scoring_key_sha256": null,
  "authority_commitments": null,
  "authorization_sha256": null
}
